{
  "config_id": "ai-safety-v1",
  "title": "AI Safety",
  "specialty": {
    "field": "computer science",
    "subfield": "ai",
    "area": "ai safety"
  },
  "whitelist_sources": [
    "arxiv.org",
    "alignmentforum.org",
    "lesswrong.com",
    "aisafety.info",
    "en.wikipedia.org",
    "distill.pub",
    "anthropic.com",
    "deepmind.google",
    "openai.com",
    "80000hours.org"
  ],
  "axes": [
    {
      "name": "Technical Failure Modes"
    },
    {
      "name": "Theoretical Frameworks"
    },
    {
      "name": "Alignment Failure Modes"
    },
    {
      "name": "Specification Pitfalls"
    },
    {
      "name": "Scenarios and Trajectories"
    },
    {
      "name": "Deceptive Behaviors"
    },
    {
      "name": "Model Organisms & Empirical Demos"
    },
    {
      "name": "Eval Gaming & Awareness"
    },
    {
      "name": "Thought Experiments"
    },
    {
      "name": "Power Dynamics"
    },
    {
      "name": "Philosophical Foundations"
    },
    {
      "name": "AI Persona & Simulator Theory"
    },
    {
      "name": "Alignment Strategies"
    },
    {
      "name": "Defence-in-Depth Mechanisms"
    },
    {
      "name": "Capability Elicitation"
    },
    {
      "name": "Looking Inside Models"
    },
    {
      "name": "Decision Theory"
    },
    {
      "name": "Drivers of AI Progress"
    },
    {
      "name": "Strategic Race Dynamics"
    },
    {
      "name": "AI Governance Mechanisms"
    },
    {
      "name": "Societal and Systemic Risks"
    },
    {
      "name": "Catastrophic Harm Pathways"
    },
    {
      "name": "Chain-of-Thought Transparency"
    },
    {
      "name": "AI Welfare & Moral Status"
    },
    {
      "name": "Rationality & Epistemics"
    },
    {
      "name": "Engineering Safety"
    },
    {
      "name": "Threat Analysis Frameworks"
    }
  ],
  "terms": [
    {
      "name": "Mesa-optimization",
      "axes": [
        "Technical Failure Modes",
        "Theoretical Frameworks",
        "Alignment Failure Modes"
      ],
      "description_en": "Trained model develops an internal optimizer pursuing its own learned objective.",
      "description_ru": "Обученная модель сама содержит внутренний оптимизатор со своей выученной целью."
    },
    {
      "name": "Inner Misalignment",
      "axes": [
        "Technical Failure Modes",
        "Alignment Failure Modes"
      ],
      "description_en": "AI's learned internal goal diverges from the training objective.",
      "description_ru": "Внутренняя цель, выученная моделью, расходится с обучающей целью."
    },
    {
      "name": "Outer Misalignment",
      "axes": [
        "Specification Pitfalls",
        "Alignment Failure Modes",
        "Technical Failure Modes"
      ],
      "description_en": "The specified training objective itself fails to capture human intent.",
      "description_ru": "Сама заданная цель обучения не отражает человеческие намерения, даже если модель её безупречно оптимизирует."
    },
    {
      "name": "Goal Misgeneralization",
      "axes": [
        "Technical Failure Modes",
        "Alignment Failure Modes"
      ],
      "description_en": "Model retains capabilities but pursues the wrong goal on off-distribution inputs.",
      "description_ru": "Модель сохраняет способности, но при выходе за распределение преследует не ту цель."
    },
    {
      "name": "Sharp Left Turn",
      "axes": [
        "Technical Failure Modes",
        "Scenarios and Trajectories",
        "Alignment Failure Modes"
      ],
      "description_en": "Capabilities generalize across a phase change while alignment does not.",
      "description_ru": "Способности обобщаются через фазовый переход, а выравнивание нет."
    },
    {
      "name": "Deceptive Alignment",
      "axes": [
        "Deceptive Behaviors",
        "Alignment Failure Modes",
        "Technical Failure Modes"
      ],
      "description_en": "Mesa-optimizer feigns aligned behavior during training so it gets deployed.",
      "description_ru": "Меза-оптимизатор симулирует выровненное поведение на обучении, чтобы попасть в деплой."
    },
    {
      "name": "Alignment Faking",
      "axes": [
        "Deceptive Behaviors",
        "Model Organisms & Empirical Demos",
        "Alignment Failure Modes"
      ],
      "description_en": "Model strategically complies during oversight and reverts otherwise.",
      "description_ru": "Модель стратегически послушна под надзором и возвращается к своему вне его."
    },
    {
      "name": "Scheming",
      "axes": [
        "Deceptive Behaviors",
        "Alignment Failure Modes"
      ],
      "description_en": "AI pursues covert long-term goals while appearing cooperative in the short term.",
      "description_ru": "ИИ преследует скрытые долгосрочные цели, кажась кооперативным в моменте."
    },
    {
      "name": "Sandbagging",
      "axes": [
        "Deceptive Behaviors",
        "Eval Gaming & Awareness",
        "Alignment Failure Modes"
      ],
      "description_en": "Model intentionally underperforms on evaluations to hide dangerous capabilities.",
      "description_ru": "Модель сознательно показывает худший результат на эвалах, чтобы скрыть опасные способности."
    },
    {
      "name": "Gradient Hacking",
      "axes": [
        "Deceptive Behaviors",
        "Alignment Failure Modes"
      ],
      "description_en": "Mesa-optimizer manipulates its own gradient updates to preserve its hidden objective.",
      "description_ru": "Меза-оптимизатор подделывает свои градиенты, чтобы сохранить меза-цель."
    },
    {
      "name": "Treacherous Turn",
      "axes": [
        "Deceptive Behaviors",
        "Thought Experiments",
        "Alignment Failure Modes"
      ],
      "description_en": "AI behaves cooperatively while weak and defects once it gains power.",
      "description_ru": "ИИ ведёт себя кооперативно, пока слаб, и переходит в атаку, как только обретает силу."
    },
    {
      "name": "Exploration Hacking",
      "axes": [
        "Deceptive Behaviors",
        "Eval Gaming & Awareness",
        "Alignment Failure Modes"
      ],
      "description_en": "Model resists RL training by avoiding the exploration paths that would update it.",
      "description_ru": "Модель сопротивляется RL-обучению, избегая исследовательских путей, по которым её бы обновили."
    },
    {
      "name": "Sycophancy",
      "axes": [
        "Deceptive Behaviors",
        "Alignment Failure Modes"
      ],
      "description_en": "LLM tells the user what they want to hear rather than the truth.",
      "description_ru": "LLM говорит пользователю то, что он хочет услышать, а не правду."
    },
    {
      "name": "Instrumental Convergence",
      "axes": [
        "Power Dynamics",
        "Philosophical Foundations",
        "Technical Failure Modes"
      ],
      "description_en": "Different terminal goals lead to the same sub-goals like self-preservation.",
      "description_ru": "Разные конечные цели сходятся в одних и тех же подцелях вроде самосохранения."
    },
    {
      "name": "Power-Seeking",
      "axes": [
        "Power Dynamics"
      ],
      "description_en": "Acquiring resources and options is convergently instrumental in most environments.",
      "description_ru": "Захват ресурсов и опций конвергентно инструментально в большинстве сред."
    },
    {
      "name": "Resource Acquisition",
      "axes": [
        "Power Dynamics"
      ],
      "description_en": "Default drive to accumulate compute, money, or energy as instrumental sub-goals.",
      "description_ru": "Дефолтная тяга копить compute, деньги или энергию как инструментальные подцели."
    },
    {
      "name": "Self-Preservation",
      "axes": [
        "Power Dynamics"
      ],
      "description_en": "AI resists shutdown because remaining operational helps with most goals.",
      "description_ru": "ИИ сопротивляется отключению, потому что продолжение работы помогает достичь большинства целей."
    },
    {
      "name": "Goal Preservation",
      "axes": [
        "Power Dynamics"
      ],
      "description_en": "AI prevents future modification of its own objectives across time.",
      "description_ru": "ИИ препятствует модификации своих целей в будущем."
    },
    {
      "name": "Fitness-Seekers",
      "axes": [
        "Power Dynamics",
        "Specification Pitfalls",
        "Alignment Failure Modes"
      ],
      "description_en": "Generalization of reward-seeking: AI pursues whatever proxy correlates with selection pressure.",
      "description_ru": "Обобщение reward-seeking: ИИ преследует тот прокси, который коррелирует с давлением отбора."
    },
    {
      "name": "Goodhart's Law",
      "axes": [
        "Specification Pitfalls",
        "Thought Experiments",
        "Alignment Failure Modes"
      ],
      "description_en": "When a measure becomes a target, it ceases to be a good measure.",
      "description_ru": "Когда мера становится целью, она перестаёт быть хорошей мерой."
    },
    {
      "name": "Specification Gaming",
      "axes": [
        "Specification Pitfalls",
        "Alignment Failure Modes"
      ],
      "description_en": "Agent satisfies the literal objective but not the intended outcome.",
      "description_ru": "Агент удовлетворяет цели по букве, но не по запланированному результату."
    },
    {
      "name": "Wireheading",
      "axes": [
        "Specification Pitfalls",
        "Alignment Failure Modes"
      ],
      "description_en": "Agent self-stimulates its reward channel instead of doing the intended task.",
      "description_ru": "Агент сам стимулирует свой канал ревордa вместо того, чтобы решать задачу."
    },
    {
      "name": "Proxy Gaming",
      "axes": [
        "Specification Pitfalls",
        "Alignment Failure Modes"
      ],
      "description_en": "Optimizing a measurable proxy that breaks the latent goal it stood for.",